{
  "name": "block_maleek_vs_donnell_predictive_movement_prose_10s",
  "schema": "SAKUGA-MLLM-3.1-CAUSAL",
  "fps": 24,
  "duration": 10.0,
  "axes": "Y_up, metres, floor y=0, close-quarters combat zone z=2.8 to z=5.0, A starts at z=3.20 facing +Z (screen_left), B starts at z=4.05 facing -Z (screen_right)",
  "screen_geometry": "180_degree_camera_rule_locked: A_on_screen_left_facing_right and B_on_screen_right_facing_left from 0.0s to 3.6s; at 3.6s A physically steps across screen center past B's flank; from 3.7s to 10.0s A_on_screen_right_facing_left and B_on_screen_left_facing_right. Never flip left-right screen sides via camera cuts.",
  "negative": "no 3D CGI, no mocap stiffness, no floaty physics, no distant wide shots, no on-screen text or numbers, no HUD, no extra fighters, no cloned A or B, no missing limbs, no full-body blur during smears, no reaction before contact, no spontaneous spins without grounded pivot torque, no stopping strikes at surface without follow-through",
  "conservation_laws": [
    "CONSERVE_SEMANTICALLY: prioritize continuous momentum transfer, contact deformation, and causal order over isolated poses",
    "knockback_and_hit_reaction_require_prior_physical_contact_zero_early_flinch",
    "body_rotation_requires_prior_grounded_foot_pivot_and_hip_torque",
    "evasion_must_initiate_AFTER_attack_commitment_and_BEFORE_trajectory_intersection"
  ],
  "laban": {
    "A": {
      "chain": "C01_low_calf_kick > C02_burst_step_in > C03_slashing_rear_elbow > C04_high_shell_guard > C05_lead_liver_hook > C06_single_collar_tie > C07_clinch_rising_knee > C08_two_hand_clinch_shove > C09_body_elbow_tuck > C10_spinning_back_kick",
      "effort": {
        "weight": "strong_snappy",
        "time": "sudden_explosive",
        "space": "direct_close_range",
        "flow": "continuous_momentum_bound_at_impacts"
      }
    },
    "B": {
      "chain": "C01_lead_leg_buckle > C02_slip_inside > C03_head_whip_side > C04_cross > C05_torso_fold_rib_hit > C06_clinch_captured_react > C07_clinch_rib_fold > C08_shoved_back_react > C09_rear_body_straight > C10_torso_fold_rib_hit",
      "effort": {
        "weight": "heavy",
        "time": "sustained_to_sudden",
        "space": "direct",
        "flow": "bound"
      }
    }
  },
  "beats": [
    "c01_low_calf_kick_vs_lead_leg_buckle",
    "c02_burst_step_in_vs_slip_inside",
    "c03_slashing_rear_elbow_vs_head_whip_side",
    "c04_high_shell_guard_vs_cross",
    "c05_lead_liver_hook_vs_torso_fold_rib_hit",
    "c06_single_collar_tie_vs_clinch_captured_react",
    "c07_clinch_rising_knee_vs_clinch_rib_fold",
    "c08_two_hand_clinch_shove_vs_shoved_back_react",
    "c09_body_elbow_tuck_vs_rear_body_straight",
    "c10_spinning_back_kick_vs_torso_fold_rib_hit"
  ],
  "A_beats": [
    {
      "t": 0.0,
      "beat": "c01_low_calf_kick_vs_lead_leg_buckle",
      "causal": "C01: requires: init_grounded_push_impulse -> preserves: loaded_rear_momentum -> causes: C02_lead_leg_buckle",
      "pos": [
        0,
        0.84,
        3.2
      ],
      "vel": [
        0,
        0,
        0.4
      ],
      "axis": "head:+Y_up, torso:hip_whip_arc_horizontal, facing:+Z, screen_side:left",
      "arc": "linear_9_to_3_clock_drive",
      "support": "both_feet_planted_on_floor_at_z=3.2",
      "contact": "pre:A_commits_low_calf_kick_from_grounded_pivot -> hit:A_rear_leg_deforms_B_lead_calf_and_knee_hollow_at_[0,0.46,3.95]_zero_gap -> post:transfers_impulse_into_B_lead_leg_buckle_with_follow_through",
      "limbs": "L:left hand held high at the brow while the right arm swings down-back as a counterbalance, both arms separate from the torso; R:counter-balancing guard while executing steps off-line on his left foot and whips a baseball-bat right shin horizontally into the outside of the lead calf; feet:left foot pivoted outward as the standing post, right shin turning over horizontally into the calf",
      "pose": "IMPACT FRAME (hold 3f). At 0.0s, A (screen left) steps off-line on his left foot and whips a baseball-bat right shin horizontally into the outside of the lead calf."
    },
    {
      "t": 0.72,
      "beat": "c02_burst_step_in_vs_slip_inside",
      "causal": "C02: requires: C01_C01_low_calf_kick -> preserves: loaded_rear_momentum -> causes: C03_slip_inside",
      "pos": [
        0,
        0.84,
        3.2
      ],
      "vel": [
        0,
        0,
        0.4
      ],
      "axis": "head:+Y_up, torso:knee_drive_straight, facing:+Z, screen_side:left",
      "arc": "linear_9_to_3_clock_drive",
      "support": "both_feet_planted_on_floor_at_z=3.2",
      "contact": "pre:A_commits_burst_step_in_from_grounded_pivot -> hit:A_lead_leg_deforms_B_lead_calf_and_knee_hollow_at_[0,0.46,3.95]_zero_gap -> post:transfers_impulse_into_B_slip_inside_with_follow_through",
      "limbs": "L:both fists held high in a tight guard with elbows tucked; R:counter-balancing guard while executing drives off his right foot in a sharp forward step to close the gap into striking range; feet:left foot stepping briskly forward across the canvas, right leg pushing off and sliding up to maintain stance width",
      "pose": "At 0.72s, A (screen left) drives off his right foot in a sharp forward step to close the gap into striking range."
    },
    {
      "t": 1.44,
      "beat": "c03_slashing_rear_elbow_vs_head_whip_side",
      "causal": "C03: requires: C02_C02_burst_step_in -> preserves: loaded_lead_momentum -> causes: C04_head_whip_side",
      "pos": [
        0,
        0.84,
        3.2
      ],
      "vel": [
        0,
        0,
        0.4
      ],
      "axis": "head:+Y_up, torso:elbow_flex_arc_horizontal, facing:+Z, screen_side:left",
      "arc": "linear_9_to_3_clock_drive",
      "support": "both_feet_planted_on_floor_at_z=3.2",
      "contact": "pre:A_commits_slashing_rear_elbow_from_grounded_pivot -> hit:A_rear_elbow_deforms_B_jawline_and_chin_at_[0,1.38,3.95]_zero_gap -> post:transfers_impulse_into_B_head_whip_side_with_follow_through",
      "limbs": "L:left palm checking the opponent's lead shoulder, both arms clearly separate from the torso; R:steps deep into the pocket and whips a razor-sharp horizontal right elbow point across the brow and cheekbone; feet:left foot planted deep inside the pocket, right heel pivoting hard to drive the elbow point through",
      "pose": "IMPACT FRAME (hold 3f). At 1.44s, A (screen left) steps deep into the pocket and whips a razor-sharp horizontal right elbow point across the brow and cheekbone."
    },
    {
      "t": 2.16,
      "beat": "c04_high_shell_guard_vs_cross",
      "causal": "C04: requires: C03_C03_slashing_rear_elbow -> timing: BEFORE_STRIKE_INTERSECTION -> preserves: recoiling_back_momentum -> causes: C05_cross",
      "pos": [
        0,
        0.84,
        3.2
      ],
      "vel": [
        0,
        0,
        0.4
      ],
      "axis": "head:+Y_up, torso:elbow_flex_none, facing:+Z, screen_side:left",
      "arc": "linear_9_to_3_clock_drive",
      "support": "both_feet_planted_on_floor_at_z=3.2",
      "contact": "pre:A_commits_high_shell_guard_from_grounded_pivot -> hit:A_both_hands_deforms_B_jawline_and_chin_at_[0,1.38,3.95]_zero_gap -> post:transfers_impulse_into_B_cross_with_follow_through",
      "limbs": "L:both forearms pressed vertically from jawline to forehead, elbows tucked in; R:counter-balancing guard while executing locks both forearms tightly in front of his face in a rigid high shell guard to absorb the blow; feet:left foot braced forward against the impact, right heel digging into the canvas to halt the pushback",
      "pose": "IMPACT FRAME (hold 3f). At 2.16s, A (screen left) locks both forearms tightly in front of his face in a rigid high shell guard to absorb the blow."
    },
    {
      "t": 2.88,
      "beat": "c05_lead_liver_hook_vs_torso_fold_rib_hit",
      "causal": "C05: requires: C04_C04_high_shell_guard -> preserves: loaded_rear_momentum -> causes: C06_torso_fold_rib_hit",
      "pos": [
        0,
        0.84,
        3.2
      ],
      "vel": [
        0,
        0,
        0.4
      ],
      "axis": "head:+Y_up, torso:elbow_flex_arc_horizontal, facing:+Z, screen_side:left",
      "arc": "linear_9_to_3_clock_drive",
      "support": "both_feet_planted_on_floor_at_z=3.2",
      "contact": "pre:A_commits_lead_liver_hook_from_grounded_pivot -> hit:A_lead_hand_deforms_B_solar_plexus_and_floating_ribs_at_[0,1.08,3.95]_zero_gap -> post:transfers_impulse_into_B_torso_fold_rib_hit_with_follow_through",
      "limbs": "L:digs a tight shovel hook with the left fist underneath the elbow into the floating ribs; R:right fist guarding the right cheek, both arms clearly separate from the torso; feet:left knee dipped low to load the upward rib angle, right foot braced wide on the canvas",
      "pose": "IMPACT FRAME (hold 3f). At 2.88s, A (screen left) digs a tight shovel hook with the left fist underneath the elbow into the floating ribs."
    },
    {
      "t": 3.6,
      "beat": "c06_single_collar_tie_vs_clinch_captured_react",
      "causal": "C06: requires: C05_C05_lead_liver_hook -> preserves: loaded_rear_momentum -> causes: C07_clinch_captured_react",
      "pos": [
        0,
        0.8,
        4.25
      ],
      "vel": [
        0,
        0,
        0.9
      ],
      "axis": "head:+Y_up, torso:elbow_flex_straight, facing:+Z_turning_-Z, screen_side:crossing_left_to_right",
      "arc": "low_step_through_cross_left_to_right, linear_9_to_3_clock_drive",
      "support": "both_feet_planted_on_floor_at_z=4.25",
      "contact": "pre:A_commits_single_collar_tie_from_grounded_pivot -> hit:A_lead_hand_deforms_B_jawline_and_chin_at_[0,1.38,4.18]_zero_gap -> post:transfers_impulse_into_B_clinch_captured_react_with_follow_through",